<?xml version="1.0" encoding="UTF-8"?>
<!--
Questo file serve per mettere in relazione le gallerie con i post 
(di tipo intervista) a cui sono collegati.
-->
<TagsPosts xmlns="http://www.musicbreak.com" 
           xmlns:xs="http://www.w3.org/2001/XMLSchema-instance" 
           xs:schemaLocation="http://www.musicbreak.com/data/XML/XMLS TagsPosts.xsd">
    <corrispondenza>
        <idTag>1</idTag>
        <idPost>2</idPost>
    </corrispondenza>
    
    <corrispondenza>
        <idTag>4</idTag>
        <idPost>2</idPost>
    </corrispondenza>
    
    <corrispondenza>
        <idTag>3</idTag>
        <idPost>2</idPost>
    </corrispondenza>
    
    <corrispondenza>
        <idTag>2</idTag>
        <idPost>3</idPost>
    </corrispondenza>
</TagsPosts>